title,comment_count,comment_texts,comment_indices,weighted_comment_sum,textlen,cluster,random,fulltext,paragraphs,weighted_comment_sumAI,commentrate,weighted_sum,wsr,wcsr
Foreign Ministry to focus on education on Rohingya issue,20,"[""Foreign ministry wants to find solution for refugees' education issues"", 'Education is important to prevent refugees from social problems', 'Being educated increases the chances for refugees to be selected by a third country', 'Foreign Ministry is looking for ways to increase funding for refugee schools', 'Issue of Rohingya refugees needs to be addressed by relevant agencies', 'Malaysia plays a role as if we are a signatory of the refugee convention when we are not', 'A viral video raises awareness about issues regarding Rohingya refugees', 'Refugees as an issue to find a solution to', 'Refugees get involved in social problems/crime', 'Refugees ""expect to be accepted by third countries""', 'Education for refugees should be empowered', 'Refugees as an issue to find a solution to', 'Refugees as an issue to find a solution to', 'Responsibility of the international community', 'Negative imagery of refugees', 'Refugee identity of criminal suspect is foregrounded ', 'Some Malaysian leaders are willing to help refugees by ranting them access to education', 'Education improves the chances of resettlement for refugees', 'Malaysian government is willing to work with external parties to give refugees access to education', 'Malaysia is not a UNHCR signatory but is willing to help']","[229, 230, 231, 232, 233, 234, 235, 236, 237, 238, 169, 236, 236, 170, 239, 62, 240, 241, 242, 243]",16.25,2006,"[160, 1, 203, 132, 245, -1, 135, 38]",0,"The Foreign Ministry is emphasising on the educational aspect to help find a solution to the Rohingya refugees issue in the country, Foreign Minister Saifuddin Abdullah said.

“Education is very important to prevent them from getting involved in social problems or crime here, besides making it easier for them to be selected by a third country,” he said at a press conference after delivering the ministry's 2022 New Year’s message in Putrajaya yesterday.

Most of them do not intend to settle in Malaysia, Saifuddin said.

ADS

“They make Malaysia a stopover and expect to be accepted by third countries, but third countries are also choosy and one of the selection criteria is that they have some education,” he said.

Saifuddin said Wisma Putra was looking at ways to empower and increase funding for refugee schools run by NGOs to ensure that Rohingya refugee children in the country were not dropped out of the education system.

“The funds are not from the people or the government but are funds that can be sought from external sources. For example, among the many sources are the funding from the Qatar Foundation,” he said.

Besides, he said, the issue of Rohingya refugees in the country needs to be addressed comprehensively and collectively by the relevant agencies and ministries.

ADS

Wisma Putra always holds discussions with the Home Ministry and the Education Ministry as well as other agencies involving the Rohingya issue in the country.

“I would like to remind that Malaysia is not a signatory to the United Nations High Commission for Refugees (UNHCR) but we play a role as if we are a signatory,” he said.

The issue of Rohingya refugees was once again raised recently after a video clip of a Rohingya child scolding people for not giving alms to him spread on social media.

Earlier, a Rohingya refugee Abd Hamim Ab Hamid, 33, known as Long Tiger, was reported to have escaped from the Tangkak Magistrate's Court lock-up on Dec 15. The man was later arrested on Dec 28.

- Bernama",10,5.524390243902439,8.100697906281157,7.790773229369721,0.003883735408459482,0.008100697906281156
Foreign Ministry says keeping tabs on Malaysians illegally residing in Australia,0,[],[],0.0,1344,"[2, 226, -1, 267, 16]",0,"KUALA LUMPUR, Aug 30 — The Foreign Ministry is monitoring the rising number of Malaysians who applied for permanent protection and refugee visas from the Australian government. In a statement today, the ministry found the number was significant as Malaysians were taking advantage of the opportunity by manipulating Australian Immigration laws to enable them to reside longer illegally. The statement also said the move had resulted in difficulties for bona fide parties who wished to study, visit and reside in Australia. Therefore, the Malaysian Foreign Ministry and the Immigration Department will continue to cooperate with the authorities in Australia to monitor the issue. “The Foreign Minister reminded Malaysians visiting any countries to adhere to the regulations and laws of the country concerned to avoid getting into trouble,” the statement said. The Australian High Commissioner to Malaysia, Andrew Goledzinowski recently revealed that 33,000 Malaysians living in Australia had exceeded the permitted 90-day period and applied for refugee status. Those applying for refugee status included tourists and students to avoid getting sent back to their country of origin. Last month, the Australian government reported receiving 4,973 applications from Malaysians for protection visa between July last year to April this year. — Bernama",8,2.6077235772357725,0.0,1.04093567251462,0.0007745057087162351,0.0
Indonesian police name five suspects for alleged trafficking of Rohingya refugees,1,['Traffickers are capitalizing on refugees sufferings by offering them services where their safety are not ensured'],[156],0.07692307692307693,1672,"[155, 105, 16, 181, 179, 99]",0,"ACEH, Sumatra (The Jakarta Post/ANN): The Aceh Police have named five suspects for allegedly trafficking Rohingya refugees to Indonesia in June. nan The suspects were identified as two fishermen from East Aceh regency, a woman from Medan in North Sumatra and two people of Rohingya ethnicity, as revealed by Aceh Police general crimes unit chief Sr. Comr. Sony Sanjaya during a recent press briefing. nan The two fishermen were tasked with renting a small boat and picking up dozens of refugees from a large ship in the middle of the sea. The vessel initially brought around 900 refugees, the police claimed. nan “They put Rohingya refugees on a smaller ship which later broke, ” Sony said on Tuesday, as quoted by kompas.com. nan Local fisherman later rescued the 94 refugees in the waters of North Aceh regency on June 24. nan Meanwhile, the female suspect from Medan was paid by the suspects of Rohingya ethnicity to pick up three refugees from a camp in Lhokseumawe, Aceh. nan “The refugees were going to be taken to Medan, before being eventually transported to Malaysia, ” Sony said. nan He added that the police were still looking for the two other suspects who allegedly acted as middlemen in the trafficking. nan In June, three Indonesian fishermen rescued 94 foreign nationals who were believed to be Rohingya refugees from a sinking cargo ship in the waters of North Aceh. They attempted to transport the group to Kuala Tanah Jambo Aye in Seunuddon district in the regency, but their engine was broken. nan They were rescued by other fishermen after traditional fishing community, Panglima Laot, received reports about them. - The Jakarta Post/Asia News Network",9,2.7,0.04600662495399337,4.526315789473685,0.0027071266683455055,4.6006624953993374e-05
Almost 300 Rohingya refugees initially bound for Malaysia arrive in Aceh,13,"[""Refugees' health after being at sea for months are a concern"", 'Refugees were denied entry at the Malaysian and Thai border due to the pandemic', 'Refugees were being kept as hostage on the boat by smugglers', 'Sympathizing imagery of refugees', 'Refugees go to other countries to seek refuge ', 'Refugees are fleeing persecution', 'Refugees are a victim of violence in their home country', 'Refugees are fleeing their refugee camps ', 'Refugees are exploited by traffickers', 'Refugees are vulnerable to diseases', 'Indonesia is not willing to accept refugees into the country', 'Malaysia and Thailand have turned away refugees due to Covid concerns', 'Traffickers are capitalizing on refugees sufferings by offering them services where their safety are not ensured']","[244, 245, 246, 223, 247, 77, 196, 248, 139, 249, 250, 251, 156]",8.973748473748472,2248,"[66, -1, 106, 85, 214, 71, 31]",0,"LHOKSEUMAWE, Sept 7 — Almost 300 Rohingya refugees believed to have been at sea for six months landed in Indonesia’s Aceh province early today, Indonesian authorities have confirmed. Acehnese police said a wooden boat carrying the Rohingya was spotted by local fishermen several kilometres off the coast of Lhokseumawe, before landing at Ujung Blang Beach just after midnight “There are 297 Rohingya according to the latest data, among them 181 women and 14 children,” Iptu Irwansya, a local police chief, told Reuters. Junaidi Yahya, head of the Red Cross in Lhokseumawe, said the group was currently being held in a temporary location. “We hope they can be moved to the evacuation centre today, but their health, especially related to Covid-19, is our main concern,” said Yahya. Among the group was one sick 13-year-old who police said was taken to hospital in an ambulance. Images of the Rohingya arrivals show lines of women in masks carrying their possessions in plastic bags, and men huddled on the floor of a thatched roof shelter. Today’s arrival follows the arrival of another vessel in late June when Acehnese fishermen rescued more than 100 Rohingya refugees, including 79 women and children, after Indonesian authorities had initially threatened to push them back. Fleeing persecution in Myanmar and refugee camps in Bangladesh, the Rohingya have for years boarded boats in an attempt to seek refuge in other Southeast Asian nations. Chris Lewa, director of the Arakan Project, a non-profit group focusing on the Rohingya crisis, said the passengers that arrived in Aceh today had set sail from southern Bangladesh at the end of March or early April, bound for Malaysia. But both Malaysian and Thai authorities pushed them back, she said, as borders tightened due to coronavirus pandemic. Smugglers split the passengers into several boats, some of which managed to land in Malaysia and Indonesia in June, but several hundred remained at sea until Sunday night. The smugglers called their families to demand payments in the weeks before they were taken to shore, she said. “The smugglers seemed to not want to try to disembark them because not everyone had paid… They were basically keeping them hostage on the boat,” she said. — Reuters",13,4.357723577235772,3.9918809936603523,6.533788174139053,0.002906489401307408,0.0039918809936603525
Retired army man dismisses viral statement condemning Rohingya refugees,15,"['A Malaysian is of the view that the government has done its best in assisting refugees but the gov should return them to their origin countries or UNHCR refugee centers', 'Helping refugees because it aligns with religio', 'Retired army man thinks that refugees want more than what is given to them', 'Refugee boats arriving on Malaysian shores were denied entry', 'Human Rights NGOs are unhappy that the government refuse to let refugees enter the country', 'Government has done enough for refugees ', 'Refugees should be repatriated', 'Malaysia has been gracious to refugees ', 'Motivated to help refugees because of religion ', 'Refugees are overdemanding ', 'NGOs condemn state authorities for denying refugees ', 'Malaysians are not open to accepting refugees and want them to be sent back', 'Religion does not influence public opinion on refugees that much', 'Malaysia has turned away refugees from entering the country', 'NGOs in Malaysia criticizes government’s action to turn away refugees']","[252, 253, 254, 255, 256, 257, 258, 259, 260, 261, 262, 263, 264, 265, 266]",15.0,2106,"[191, -1, 179, 32, 16, 91, 203, 180, 272]",0,"A retired army personnel has been linked to a condemning statement about the Rohingya refugees in Malaysia.

Mohd Radzi Abdul Hamid's purported official statement on the Rohingya entitled ""Siapakah Rohingya?"" (Who are the Rohingya?) has circulated on social media and shared by thousands of netizens.

Startled by the incident, Mohd Radzi had issued a statement explaining that an unscrupulous individual had used his full name and picture, as well as highlighting the Malaysian Armed Forces in the statement.

""The statement was widely spread for personal interest and I don't know why,"" he said.

ADS

When contacted, Mohd Radzi explained that the excerpts of the article were taken from his casual chat with his followers on Facebook.

""Someone had irresponsibly copied the article, tweaked it, and made it look official by inserting my picture, full name, and stating the Malaysian Armed Forces.

""This is wrong,"" he said.

Asked on his views on the Rohingya issue, Mohd Radzi said the government had assisted the refugees the best that it could but the government should return the refugees to their countries of origin or refugee centres under the United Nations High Commissioner for Refugees (UNHCR).

ADS

""We have helped them the best that we could although we did not sign the 1951 Refugee Convention. They should be sent back home or to a refugee centre. The UNHCR should decide.

""We helped them because our religion teaches us to help, but we also have to be mindful. They want more than what is given,"" he said.

The issue about the Rohingya surfaced after the authorities prevented boats ferrying Rohingya refugees from arriving on Malaysian shores recently.

Human rights NGO Amnesty International, among others, had slammed the authorities for not allowing the refugees to enter the country.

Keep up with the latest information on the outbreak in the country with Malaysiakini's free Covid-19 tracker.

Malaysiakini is providing free access to the most important updates on the coronavirus pandemic. You can find them here.

Help keep independent media alive - subscribe to Malaysiakini.",10,4.307723577235772,7.122507122507122,5.581546458739441,0.002650306960465072,0.007122507122507123
New Covid-19 cases hit triple digits again and 10 news from yesterday,1,['Refugees should be accepted '],[267],1.0,1688,"[9, 295, -1, 248, 242]",0,"KINI ROUNDUP | Key headlines you may have missed yesterday, in brief.

1. Covid-19 cases rose to 105, the highest in 16 days, with 94 cases being locally transmitted.

2. Health Ministry director-general Dr Noor Hisham Abdullah said the responsibility to prevent new infections now lies on the public, who must practice social distancing.

ADS

3. Sarawak and Kedah have said they will not be implementing the conditional movement control order on Monday, while Selangor aims to slow down implementation.

4. Malaysians planning to return from their hometowns for Hari Raya Aidilfitri can expect to begin their journey from between May 7 and May 10.

ADS

5. Foreigners who have overstayed in the country until 14 days after the end of the MCO are allowed to leave Malaysia without being blacklisted or issued a compound.

6. Deputy Federal Territories Minister Edmund Santhara explained why food could not arrive at lockdown areas immediately.

7. Nurulhidayah, the daughter of Umno president Ahmad Zahid Hamidi, will be charged soon for violating the movement control order. She says she is prepared to face the charges.

8. Umno deputy president Mohamad Hasan declined a political appointment to helm Tenaga Nasional Berhad (TNB).

9. MCA vice-president Ti Lian Ker will be appointed as the deputy national unity minister according to sources.

10. Johor Bersatu information chief Ya'cob Atan warned of efforts to drive a wedge between his party and Umno in a bid to bring down the Perikatan Nasional government.

11. Negeri Sembilan Bersatu chief Rais Yatim said lessons should be learnt from the country's past experience in accepting other races when dealing with Rohingya refugees.",10,3.524390243902439,0.5924170616113744,2.0467836257309937,0.0012125495413098303,0.0005924170616113745
"47 Rohingya refugees stranded on beach in Perlis, 41 arrested (Updated)",6,"['Refugees were taken advantage of by Thai boat skippers', 'Sympathizing imagery of refugees', 'Sympathizing imagery of refugees', 'Traffickers are capitalizing on refugees sufferings by offering them services where their safety are not ensured', 'Refugees that enter Malaysia are at risk of being detained by the authorities', 'Traffickers are capitalizing on refugees sufferings by offering them services where their safety are not ensured']","[268, 223, 223, 156, 269, 156]",2.4395604395604393,1201,"[211, -1, 219, 31, 117]",0,"KANGAR: Forty-seven Rohingya refugees were stranded on the Sungai Baru beach in Simpang Empat near here at about 5.30am today, believed to have been abandoned by the boat skipper paid to take them here.

The male refugees, aged between 14 and 30, were smeared with mud and looking tired and hungry when they entered the nearby village.

Perlis Police chief SAC Datuk Noor Mushar Mohamed said initial investigations revealed that 47 refugees landed at the beach, but only 41 of them had been taken into custody, while the other six were still unaccounted for.

“They paid the Thai boat skipper RM4,000 each to be brought to Malaysia in a big boat, but the skipper dropped them off at the Sungai Baru muddy beach, which the group had to wade through for about an hour before they reach the shore,” he said in a statement today.

Noor Mushar said the refugees then broke into several groups and entered the village when no local skipper would take them to their next destination in the country.

He said the 41 refugees had been handed over to the Perlis Immigration Department for further action and that it was hoped that anyone knowing the whereabouts of the other six to contact the police. — Bernama",6,2.857723577235772,2.0312743043800494,4.807017543859649,0.004002512526111281,0.0020312743043800494
Home minister: Former Bangladesh high commissioner’s arrest in accordance with the law,1,['Refugees in Malaysia are not safe from being detained and sent back to their origin country'],[270],1.0,1913,"[-1, 183, 256, 225]",1,"PUTRAJAYA, Feb 10 ― Home Minister Datuk Seri Hamzah Zainudin today confirmed that former Bangladesh High Commissioner, Mohammed Khairuzzaman, is currently detained by the authorities. Without disclosing what offence Mohammed Khairuzzaman was arrested for, he said the arrest of the former diplomat was carried out in accordance with existing legal procedures, “If there is a request from the country of origin that we feel has a basis, then we will make (arrest) and everything is done according to existing legal procedures,” he said. Hamzah said this when asked to comment on the detention of Mohammed Khairuzzaman, as reported by the international media today, in a press conference after chairing the Committee on the Management of Foreign Nationals in Sabah (JKPWAS) meeting with Sabah Chief Minister Datuk Seri Hajiji Noor here today. According to media reports, Mohammed Khairuzzaman, who is reported to be living in Malaysia as a refugee, was detained at his home in Ampang yesterday, and is expected to be sent home to Bangladesh. On another development, Hamzah, who is the Parti Pribumi Bersatu Malaysia (Bersatu) secretary-general, described the speculation on two Bersatu ministers wanting to rejoin Umno, as psychological warfare. “If there are rumours, don’t just simply believe them. If it is announced by those who wanted to quit (Bersatu), then you can believe it,” he said. Hamzah added that psychological warfare was immediately created by politicians for the benefit of their respective parties, especially ahead of the Johor state election which is scheduled to take place on March 12. “This (psychological warfare) often happens… why is it coming out before the Johor state election? It is supposed to tell the people of Johor not to believe in Bersatu,” he said. Earlier, a local news portal revealed that two ministers from Bersatu were reported to quit the party to rejoin Umno. ― Bernama",10,1.8577235772357723,0.5227391531625718,2.0467836257309937,0.001069933939221638,0.0005227391531625719
"Saudi Arabia, UAE agree to join Malaysia to help Rohingya refugees",5,"['Saudi Arabia and UAE are helping refugees', 'Transnational refugee aid to improve the image of Islamic states ', 'Refugee aid as a photo op ', 'Saudi Arabia, UAE and Malaysia are working together to help Rohingya refugees in Bangladesh', 'Religion is the main drive to help refugees for SA, UAE and Malaysia']","[271, 272, 273, 274, 275]",5.0,1740,"[-1, 87, 134, 107, 2]",0,"KLUANG: Saudi Arabia and the United Arab Emirates (UAE) have agreed to cooperate with Malaysia to help the Rohingya refugees in Bangladesh.

Defence Minister Datuk Seri Hishammuddin Tun Hussein (pix) said this was stated by Saudi Crown Prince Mohammed Salman and UAE Crown Prince Sheikh Mohammed Zayed Al-Nahyan recently.

""During my visit to Morocco, I had contacted the two crown princes and they agreed to join us (Malaysia) to help the Rohingya refugees in Bangladesh.

""The UAE and Saudi Arabia have agreed to channel donations and medicines to Hospital Medan Malaysia at Cox's Bazar, Bangladesh and God-willing, in the near future we will see the three flags of Malaysia, Saudi Arabia and the UAE fly in Bangladesh,"" he said.

He was speaking to reporters after the handover ceremony of a school van and mock cheque for bus fare subsidy for students of Ladang Landak in Paloh near here today.

Hishammuddin, who is also Special Functions Minister and Sembrong MP said it was not easy for three countries to galvanise efforts to help the Rohingya, but it could help to enhance the image of an Islamic state that had long been regarded as extremist, backward and fighting among themselves.

""An agreement has been reached. We hope to have the three flags raised during Prime Minister Datuk Seri Najib Abdul Razak's visit to the refugee camp, which is expected to be this month,"" he said.

Meanwhile, on his visit to Morocco from Dec 22-24 last year, he noted the country was seen as a gateway to Malaysia in building relations with new countries because Morocco was located between Europe, West Asia and Africa.

He said relations with Morocco would also help Malaysia improve intelligence and military in combating terrorism. — Bernama",9,3.274390243902439,2.8735632183908044,3.0350877192982453,0.0017443032869530145,0.0028735632183908046
